{
  "id": "variant-twitter-v3-wheeltop-eds-purchase-route-2026-08-28",
  "target": { "record_type": "variant", "record_id": "twitter-v3-wheeltop-eds" },
  "field": "purchase-route",
  "priority": "medium",
  "searched_at": "2026-08-28",
  "required_channels": ["web"],
  "channels": {
    "web": {
      "status": "found",
      "attempts": [
        { "attempt": 1, "query": "TWITTER Gravel V3 WheelTop EDS TX current purchase route", "route": "official regional exact-build store", "outcome": "found", "accessed_at": "2026-08-28", "result_url": "https://twitterbikeusa.com/products/%F0%9F%86%93-free-shipping-delivery-3-days-gravel-v3-wireless-wheeltop-eds-tx-2-12-speed-holographic-l-54cm", "note": "Exact Holographic / L (54 cm) WheelTop build is orderable at US$1,750 through the official regional store; the Shenzhen manufacturer also exposes a direct-contact route." }
      ]
    }
  },
  "status": "found",
  "accepted_source_ids": ["twitter-v3-official-2026-08-28", "twitter-v3-wheeltop-regional-2026-08-28"],
  "retry_after": null,
  "notes": "Foreign and manufacturer-contact routes are recorded without implying current mainland stock or checkout terms."
}
