{
  "id": "variant-pardus-super-sport-gen2-egr-price-2026-08-17",
  "target": {
    "record_type": "variant",
    "record_id": "pardus-super-sport-gen2-egr"
  },
  "field": "price",
  "priority": "high",
  "searched_at": "2026-08-17",
  "required_channels": [
    "public-post",
    "web"
  ],
  "channels": {
    "public-post": {
      "status": "blocked",
      "blocker": "One or more public routes returned a verification or security challenge; no challenge was solved.",
      "attempts": [
        {
          "attempt": 1,
          "query": "PARDUS Super Sport Gen2 eGR current mainland complete/full-bike price community",
          "route": "YouTube public search",
          "outcome": "no-result",
          "accessed_at": "2026-08-17",
          "note": "No opened exact-model public post accepted from this English query."
        },
        {
          "attempt": 2,
          "query": "瑞豹 Super Sport 二代 电变 current mainland complete/full-bike price",
          "route": "Xiaohongshu public search",
          "outcome": "blocked",
          "accessed_at": "2026-08-17",
          "note": "CAPTCHA/verification was not solved per policy."
        },
        {
          "attempt": 3,
          "query": "PARDUS Super Sport Gen2 eGR Super Sport 二代 电变 2026 current mainland complete/full-bike price review build",
          "route": "Bilibili public search",
          "outcome": "blocked",
          "accessed_at": "2026-08-17",
          "note": "Search cards alone were not accepted as evidence; no CAPTCHA or security challenge was solved."
        }
      ]
    },
    "web": {
      "status": "not-run",
      "attempts": []
    }
  },
  "status": "open",
  "accepted_source_ids": [],
  "retry_after": null,
  "notes": "Round-three systematic search. public: temporarily-exhausted. Unknowns and blocks are not negative evidence."
}
